Microsoft Windows [Version 10.0.19042.985]
(c) Microsoft Corporation. All rights reserved.

C:\Users\IRWAN>psql --username postgres
Password for user postgres:
psql (13.3)
WARNING: Console code page (437) differs from Windows code page (1252)
         8-bit characters might not work correctly. See psql reference
         page "Notes for Windows users" for details.
Type "help" for help.
postgres=# CREATE USER developer WITH ENCRYPTED PASSWORD 'supersecretpassword';
CREATE ROLE
postgres=# CREATE DATABASE companydb;
CREATE DATABASE
postgres=# GRANT ALL PRIVILEGES ON DATABASE companydb TO developer;
GRANT
postgres=#


 ###.....Mengakses Database : Dengan User yg baru dibuat.....####

postgres=# \q

C:\Users\IRWAN>psql --username developer --dbname companydb
Password for user developer:
psql (13.3)
WARNING: Console code page (437) differs from Windows code page (1252)
         8-bit characters might not work correctly. See psql reference
         page "Notes for Windows users" for details.
Type "help" for help.


 ###.....Pengenalan SQL (Structured Query Language) : Create, Read, Update dan Delete.....####

companydb=> create table karyawan(
companydb(> id varchar(8) primary key,
companydb(> nama_lengkap varchar(30) not null,
companydb(> email varchar(50) unique not null,
companydb(> alamat text
companydb(> );
CREATE TABLE
companydb=> INSERT INTO karyawan(id, nama_lengkap, email, alamat)
companydb-> VALUES ('DCD001', 'Dimas Maulana', 'dimas@dicoding.com', 'Batik Kumeli No. 50 Bandung');
INSERT 0 1
companydb=> select * from karyawan;
   id   | nama_lengkap  |       email        |           alamat
--------+---------------+--------------------+-----------------------------
 DCD001 | Dimas Maulana | dimas@dicoding.com | Batik Kumeli No. 50 Bandung
(1 row)
companydb=> INSERT INTO karyawan VALUES ('DCD002', 'Gilang Ramadhan', 'gilang@dicoding.com', 'Batik Kumeli No. 50 Bandung');
INSERT 0 1
companydb=> SELECT id, nama_lengkap FROM karyawan;
   id   |  nama_lengkap
--------+-----------------
 DCD001 | Dimas Maulana
 DCD002 | Gilang Ramadhan
(2 rows)
companydb=> SELECT * FROM karyawan WHERE nama_lengkap = 'Gilang Ramadhan';
   id   |  nama_lengkap   |        email        |           alamat
--------+-----------------+---------------------+-----------------------------
 DCD002 | Gilang Ramadhan | gilang@dicoding.com | Batik Kumeli No. 50 Bandung
(1 row)

companydb=> UPDATE karyawan
companydb-> SET nama_lengkap = 'Gilang Ramadan'
companydb-> WHERE id = 'DCD002';
UPDATE 1
companydb=> DELETE FROM karyawan WHERE id = 'DCD001';
DELETE 1
companydb=> select * from karyawan;
   id   |  nama_lengkap  |        email        |           alamat
--------+----------------+---------------------+-----------------------------
 DCD002 | Gilang Ramadan | gilang@dicoding.com | Batik Kumeli No. 50 Bandung
(1 row)


companydb=>

#
#
#
#
#
#
		SYNTAKS POSTGRESQL LAINNYA:
==>
openmusic=> truncate songs;
TRUNCATE TABLE
openmusic=> select * from songs;
 id | title | year | performer | genre | duration | created_at | updated_at
----+-------+------+-----------+-------+----------+------------+------------
(0 rows)


openmusic=> ALTER TABLE songs RENAME COLUMN created_at TO inserted_at;
ALTER TABLE
openmusic=> select * from songs;
 id | title | year | performer | genre | duration | inserted_at | updated_at
----+-------+------+-----------+-------+----------+-------------+------------
(0 rows)